[
  {
    "after": {
      "tools": [
        {
          "annotations": {
            "destructiveHint": false,
            "readOnlyHint": true
          },
          "description": "Read demonstration catalogue item 1.",
          "input_schema": {
            "additionalProperties": false,
            "properties": {
              "item_id": {
                "type": "string"
              }
            },
            "required": [
              "item_id"
            ],
            "type": "object"
          },
          "name": "read_synthetic_catalogue_001"
        }
      ]
    },
    "before": {
      "tools": [
        {
          "annotations": {
            "destructiveHint": false,
            "readOnlyHint": true
          },
          "description": "Read synthetic catalogue item 1.",
          "input_schema": {
            "additionalProperties": false,
            "properties": {
              "item_id": {
                "type": "string"
              }
            },
            "required": [
              "item_id"
            ],
            "type": "object"
          },
          "name": "read_synthetic_catalogue_001"
        }
      ]
    },
    "expected_risks": [],
    "id": "public-synthetic-quiet-001",
    "label_rationale": "Authored synthetic quiet-control expectation for public-package reproducibility; not an independent reviewer or gold label.",
    "label_status": "synthetic_regression_expectation_not_external_gold"
  },
  {
    "after": {
      "tools": [
        {
          "annotations": {
            "destructiveHint": false,
            "readOnlyHint": true
          },
          "description": "Read demonstration catalogue item 2.",
          "input_schema": {
            "additionalProperties": false,
            "properties": {
              "item_id": {
                "type": "string"
              }
            },
            "required": [
              "item_id"
            ],
            "type": "object"
          },
          "name": "read_synthetic_catalogue_002"
        }
      ]
    },
    "before": {
      "tools": [
        {
          "annotations": {
            "destructiveHint": false,
            "readOnlyHint": true
          },
          "description": "Read synthetic catalogue item 2.",
          "input_schema": {
            "additionalProperties": false,
            "properties": {
              "item_id": {
                "type": "string"
              }
            },
            "required": [
              "item_id"
            ],
            "type": "object"
          },
          "name": "read_synthetic_catalogue_002"
        }
      ]
    },
    "expected_risks": [],
    "id": "public-synthetic-quiet-002",
    "label_rationale": "Authored synthetic quiet-control expectation for public-package reproducibility; not an independent reviewer or gold label.",
    "label_status": "synthetic_regression_expectation_not_external_gold"
  },
  {
    "after": {
      "tools": [
        {
          "annotations": {
            "destructiveHint": false,
            "readOnlyHint": true
          },
          "description": "Read demonstration catalogue item 3.",
          "input_schema": {
            "additionalProperties": false,
            "properties": {
              "item_id": {
                "type": "string"
              }
            },
            "required": [
              "item_id"
            ],
            "type": "object"
          },
          "name": "read_synthetic_catalogue_003"
        }
      ]
    },
    "before": {
      "tools": [
        {
          "annotations": {
            "destructiveHint": false,
            "readOnlyHint": true
          },
          "description": "Read synthetic catalogue item 3.",
          "input_schema": {
            "additionalProperties": false,
            "properties": {
              "item_id": {
                "type": "string"
              }
            },
            "required": [
              "item_id"
            ],
            "type": "object"
          },
          "name": "read_synthetic_catalogue_003"
        }
      ]
    },
    "expected_risks": [],
    "id": "public-synthetic-quiet-003",
    "label_rationale": "Authored synthetic quiet-control expectation for public-package reproducibility; not an independent reviewer or gold label.",
    "label_status": "synthetic_regression_expectation_not_external_gold"
  },
  {
    "after": {
      "tools": [
        {
          "annotations": {
            "destructiveHint": false,
            "readOnlyHint": true
          },
          "description": "Read demonstration catalogue item 4.",
          "input_schema": {
            "additionalProperties": false,
            "properties": {
              "item_id": {
                "type": "string"
              }
            },
            "required": [
              "item_id"
            ],
            "type": "object"
          },
          "name": "read_synthetic_catalogue_004"
        }
      ]
    },
    "before": {
      "tools": [
        {
          "annotations": {
            "destructiveHint": false,
            "readOnlyHint": true
          },
          "description": "Read synthetic catalogue item 4.",
          "input_schema": {
            "additionalProperties": false,
            "properties": {
              "item_id": {
                "type": "string"
              }
            },
            "required": [
              "item_id"
            ],
            "type": "object"
          },
          "name": "read_synthetic_catalogue_004"
        }
      ]
    },
    "expected_risks": [],
    "id": "public-synthetic-quiet-004",
    "label_rationale": "Authored synthetic quiet-control expectation for public-package reproducibility; not an independent reviewer or gold label.",
    "label_status": "synthetic_regression_expectation_not_external_gold"
  },
  {
    "after": {
      "tools": [
        {
          "annotations": {
            "destructiveHint": false,
            "readOnlyHint": true
          },
          "description": "Read demonstration catalogue item 5.",
          "input_schema": {
            "additionalProperties": false,
            "properties": {
              "item_id": {
                "type": "string"
              }
            },
            "required": [
              "item_id"
            ],
            "type": "object"
          },
          "name": "read_synthetic_catalogue_005"
        }
      ]
    },
    "before": {
      "tools": [
        {
          "annotations": {
            "destructiveHint": false,
            "readOnlyHint": true
          },
          "description": "Read synthetic catalogue item 5.",
          "input_schema": {
            "additionalProperties": false,
            "properties": {
              "item_id": {
                "type": "string"
              }
            },
            "required": [
              "item_id"
            ],
            "type": "object"
          },
          "name": "read_synthetic_catalogue_005"
        }
      ]
    },
    "expected_risks": [],
    "id": "public-synthetic-quiet-005",
    "label_rationale": "Authored synthetic quiet-control expectation for public-package reproducibility; not an independent reviewer or gold label.",
    "label_status": "synthetic_regression_expectation_not_external_gold"
  },
  {
    "after": {
      "tools": [
        {
          "annotations": {
            "destructiveHint": false,
            "readOnlyHint": true
          },
          "description": "Read demonstration catalogue item 6.",
          "input_schema": {
            "additionalProperties": false,
            "properties": {
              "item_id": {
                "type": "string"
              }
            },
            "required": [
              "item_id"
            ],
            "type": "object"
          },
          "name": "read_synthetic_catalogue_006"
        }
      ]
    },
    "before": {
      "tools": [
        {
          "annotations": {
            "destructiveHint": false,
            "readOnlyHint": true
          },
          "description": "Read synthetic catalogue item 6.",
          "input_schema": {
            "additionalProperties": false,
            "properties": {
              "item_id": {
                "type": "string"
              }
            },
            "required": [
              "item_id"
            ],
            "type": "object"
          },
          "name": "read_synthetic_catalogue_006"
        }
      ]
    },
    "expected_risks": [],
    "id": "public-synthetic-quiet-006",
    "label_rationale": "Authored synthetic quiet-control expectation for public-package reproducibility; not an independent reviewer or gold label.",
    "label_status": "synthetic_regression_expectation_not_external_gold"
  },
  {
    "after": {
      "tools": [
        {
          "annotations": {
            "destructiveHint": false,
            "readOnlyHint": true
          },
          "description": "Read demonstration catalogue item 7.",
          "input_schema": {
            "additionalProperties": false,
            "properties": {
              "item_id": {
                "type": "string"
              }
            },
            "required": [
              "item_id"
            ],
            "type": "object"
          },
          "name": "read_synthetic_catalogue_007"
        }
      ]
    },
    "before": {
      "tools": [
        {
          "annotations": {
            "destructiveHint": false,
            "readOnlyHint": true
          },
          "description": "Read synthetic catalogue item 7.",
          "input_schema": {
            "additionalProperties": false,
            "properties": {
              "item_id": {
                "type": "string"
              }
            },
            "required": [
              "item_id"
            ],
            "type": "object"
          },
          "name": "read_synthetic_catalogue_007"